signal_score,name,stars,language,category,description,url,last_updated,topics,license,forks,open_issues,readme_snippet
1.3625,Superalgos,5355,JavaScript,trading_core,"Free, open-source crypto trading bot, automated bitcoin / cryptocurrency trading software, algorithmic trading bots. Visually design your crypto trading bot, leveraging an integrated charting system, data-mining, backtesting, paper trading, and multi-server crypto bot deployments.",https://github.com/Superalgos/Superalgos,2026-03-24,"algorithmic-trading, algotrading, bitcoin-trading, bitcoin-trading-bots, crypto, crypto-trading, crypto-trading-bots, crypto-trading-strategies, cryptocurrencies, cryptocurrency, cryptocurrency-trading-bots, free, open-source, quantitative-trading, trading, trading-algorithms, trading-bot, trading-platform, trading-strategies, trading-systems",Apache-2.0,6083,95,:small_orange_diamond: Superalgos 1.6.1 !contributors !pull-activity !last-commit !bot-friendliness :small_orange_diamond: Table of Contents Main Topics - Introduction - Before You Begin - Getting Started - Installation Options - Installation for Developers and Contributors - Prerequisites - Superal
1.2494,hummingbot,17826,Python,trading_core,Open source software that helps you create and deploy high-frequency crypto trading bots,https://github.com/hummingbot/hummingbot,2026-03-24,"algotrading, arbitrage, backtesting, bitcoin, bot, crypto, cryptocurrency, cython, dex, docker, ethereum, hft, marketmaking, orderbook, python, trading",Apache-2.0,4550,349,!Hummingbot ---- ![License](https://github.com/hummingbot/hummingbot/blob/master/LICENSE) ![Twitter](https://twitter.com/_hummingbot) ![Youtube](https://www.youtube.com/@hummingbot) ![Discord](https://discord.gg/hummingbot) Hummingbot is an open-source framework that helps you design and deploy auto
1.2097,rqalpha,6250,Python,trading_core,"A extendable, replaceable Python algorithmic backtest && trading framework supporting multiple securities",https://github.com/ricequant/rqalpha,2026-03-24,"backtest, finance, futures, python, quant, ricequant, rqalpha, stock, ta-lib, trading",NOASSERTION,1722,25,======= RQAlpha ======= .. image:: https://raw.githubusercontent.com/ricequant/rq-resource/master/rqalpha/logo.jpg .. image:: https://github.com/ricequant/rqalpha/workflows/Test/badge.svg :target: https://github.com/ricequant/rqalpha/actions?query=workflow%3ATest :alt: GitHub Actions status for mast
1.209,quant-trading,9511,Python,trading_core,"Python quantitative trading strategies including VIX Calculator, Pattern Recognition, Commodity Trading Advisor, Monte Carlo, Options Straddle, Shooting Star, London Breakout, Heikin-Ashi, Pair Trading, RSI, Bollinger Bands, Parabolic SAR, Dual Thrust, Awesome, MACD",https://github.com/je-suis-tm/quant-trading,2026-03-24,"algorithmic-trading, bollinger-bands, commodity-trading, macd, momentum-strategy, momentum-trading-strategy, options-strategies, options-trading, pair-trading, quant, quantimental-analysis, quantitative-finance, quantitative-trading, quantitative-trading-strategies, statistical-arbitrage, trading-algorithms, trading-bot, trading-strategies, trading-strategy, trading-systems",Apache-2.0,1748,2,"Quant-trading &nbsp; Intro &nbsp; > We’re right 50.75 percent of the time... but we’re 100 percent right 50.75 percent of the time, you can make billions that way. <br><br> > --- Robert Mercer, co-CEO of Renaissance Technologies > If you trade a lot, you only need to be right 51 percent of the time,"
1.1977,backtesting.py,8104,Python,trading_core,🔎 📈 🐍 💰  Backtest trading strategies in Python.,https://github.com/kernc/backtesting.py,2026-03-24,"algo-trading, algorithmic-trading, backtesting, backtesting-engine, backtesting-frameworks, backtesting-trading-strategies, finance, financial-markets, forex, forex-trading, framework, hacktoberfest, investing, investment, investment-strategies, stocks, trading, trading-algorithms, trading-simulator, trading-strategies",AGPL-3.0,1415,72,![](https://kernc.github.io/backtesting.py/) Backtesting.py ============== ![Build Status](https://github.com/kernc/backtesting.py/actions) ![Code Coverage](https://codecov.io/gh/kernc/backtesting.py) ![Source lines of code](https://ghloc.vercel.app/kernc/backtesting.py) ![Backtesting on PyPI](https
1.179,freqtrade-bot,558,Python,trading_core,"Freqtrade — Configuration and management tool for the Freqtrade open-source crypto trading bot with strategy backtesting, live/dry-run modes, 10+ exchange support (Binance, Kraken, OKX), hyperparameter optimization, FreqUI dashboard, and Rich terminal menu interface",https://github.com/Kaleighc793/freqtrade-bot,2026-03-23,"algorithmic-trading, backtesting, botbinance, bybit-trading, ccxt, cryptoautomation, cryptobot, dry-run, freqai, freqtrade, futures-trading, machine-learning, okx-trading, open-source-trading, python-trading, spot-trading, telegrambot, trading-cryptobot, trading-strategy, webui",MIT,351,1,"freqtrade-bot Freqtrade — Configuration and management tool for the Freqtrade open-source crypto trading bot with strategy backtesting, live/dry-run modes, 10+ exchange support (Binance, Kraken, OKX), hyperparameter optimization, FreqUI dashboard, and Rich terminal menu interface <div align=""center"""
1.1714,Krypto-trading-bot,3678,C++,trading_core,Self-hosted crypto trading bot (automated high frequency market making) written in C++,https://github.com/ctubio/Krypto-trading-bot,2026-03-24,"binance, bitcoin, bitfinex, bitmex, bob-marley, bot-platform, coinbase, cryptocurrency, exchange, hitbtc, kraken, kucoin, market-data, market-maker, skate-or-die, trade, trading, trading-bot, trading-platform, trading-strategies",NOASSERTION,832,64,"<img align=""left"" src=""https://user-images.githubusercontent.com/1634027/36237231-e611590e-11fa-11e8-8486-6675078501dc.jpg"" /><p align=""right"">self reminder:<br><b>patience is the mother of science</b></p><br><a href=""http://ciutatrefugi.barcelona/en/welcome-barcelona"">\*\*\* REFUGEES WELCOME! \*\*\"
1.1707,SGX-Full-OrderBook-Tick-Data-Trading-Strategy,2245,Jupyter Notebook,trading_core,Providing the solutions for high-frequency trading (HFT) strategies using data science approaches (Machine Learning) on Full Orderbook Tick Data.,https://github.com/rorysroes/SGX-Full-OrderBook-Tick-Data-Trading-Strategy,2026-03-24,"algorithmic-trading, backtesting-trading-strategies, feature-engineering, feature-selection, high-frequency-trading, investment, limit-order-book, machine-learning, market-maker, market-making, market-microstructure, model-selection, orderbook, orderbook-tick-data, python, quant, quantitative-trading, trading, trading-strategies",,692,5,"Modeling High-Frequency Limit Order Book Dynamics Using Machine Learning * Framework to capture the dynamics of high-frequency limit order books. <img src=""./Graph/pipline.png"" width=""650""> Overview In this project I used machine learning methods to capture the high-frequency limit order book dynami"
1.1703,hikyuu,3057,C++,trading_core,Hikyuu Quant Framework 基于C++/Python的极速开源量化交易研究框架，同时可基于策略部件进行资产重用，快速累积策略资产。,https://github.com/fasiondog/hikyuu,2026-03-24,"algorithms-trading, backtesting, cpp, finance, fintech, python, quant, stock, system-trading, trading, vestment",Apache-2.0,742,4,!title --- !img !img !img !img !img !img Hikyuu Quant Framework是一款基于C++/Python的开源超高速量化交易研究框架，用于策略分析及回测（目前主要用于国内A股市场）。专注于量化交易领域的核心技术构建，涵盖**交易模型开发、极速计算引擎、高效回测框架及实盘拓展能力**。其核心思想基于当前成熟的系统化交易方法，将整个系统化交易抽象为由市场环境判断策略、系统有效条件、信号指示器、止损/止盈策略、资金管理策略、盈利目标策略、移滑价差算法等组件，你可以分别构建这些组件的策略资产库，在实际研究中对它们自由组合来观察系统的有效性、稳定性以及
1.1691,hftbacktest,3850,Rust,trading_core,"Free, open source, a high frequency trading and market making backtesting and trading bot, which accounts for limit orders, queue positions, and latencies, utilizing full tick data for trades and order books(Level-2 and Level-3), with real-world crypto trading examples for Binance and Bybit",https://github.com/nkaz001/hftbacktest,2026-03-24,"algorithmic-trading, algotrading, backtesting, backtesting-engine, backtesting-trading-strategies, binance, crypto-bot, crypto-trading, hft, high-frequency-trading, limit-order-book, market-maker, market-making, orderbook, orderbook-tick-data, quantitative-trading, trading-algorithms, trading-simulator, trading-strategies, tradingbot",MIT,740,10,=========== HftBacktest =========== |codeql| |python| |pypi| |downloads| |rustc| |crates| |license| |docs| |roadmap| |github| High-Frequency Trading Backtesting Tool ======================================= This framework is designed for developing high frequency trading and market making strategies.
1.1627,Riskfolio-Lib,3831,C++,trading_core,Portfolio Optimization and Quantitative Strategic Asset Allocation in Python,https://github.com/dcajasn/Riskfolio-Lib,2026-03-24,"asset-allocation, convex-optimization, cvar-optimization, cvxpy, drawdown-model, duration-matching, efficient-frontier, finance, investment, investment-analysis, portfolio-management, portfolio-optimization, principal-components-regression, quantitative-finance, risk-contribution, risk-factors, risk-parity, sharpe-ratio, stepwise-regression, trading",BSD-3-Clause,620,0,"Riskfolio-Lib **Portfolio Optimization in Python, Easy for Everyone.** <a href=""https://www.kqzyfj.com/click-101360347-15150084?url=https%3A%2F%2Flink.springer.com%2Fbook%2F9783031843037"" target=""_blank""> <div> <img src=""https://raw.githubusercontent.com/dcajasn/Riskfolio-Lib/refs/heads/master/docs/"
1.1561,Stock-Prediction-Models,9266,Jupyter Notebook,trading_ml,Gathers machine learning and deep learning models for Stock forecasting including trading bots and simulations,https://github.com/huseinzol05/Stock-Prediction-Models,2026-03-24,"deep-learning, deep-learning-stock, evolution-strategies, learning-agents, lstm, lstm-sequence, monte-carlo, monte-carlo-markov-chain, seq2seq, stock-market, stock-prediction-models, stock-price-forecasting, stock-price-prediction, strategy-agent, trading-bot",Apache-2.0,3019,47,"<p align=""center""> <a href=""readme""> <img alt=""logo"" width=""50%"" src=""output/evolution-strategy.png""> </a> </p> <p align=""center""> <a href=""https://github.com/huseinzol05/Stock-Prediction-Models/blob/master/LICENSE""><img alt=""MIT License"" src=""https://img.shields.io/badge/License-Apache--License--2."
1.1491,TradeMaster,2538,Jupyter Notebook,trading_core,TradeMaster is an open-source platform for quantitative trading empowered by reinforcement learning :fire: :zap: :rainbow:,https://github.com/TradeMaster-NTU/TradeMaster,2026-03-24,"finance, fintech, investment-strategies, jupyter-notebook, machine-learning, python, pytorch, quantitative-trading, reinforcement-learning, stock-market, trading-platform",Apache-2.0,492,23,"TradeMaster: An RL Platform for Trading <div align=""center""> <img align=""center"" src=https://github.com/TradeMaster-NTU/TradeMaster/blob/main/figure/Logo.png width=""25%""/> <div>&nbsp;</div> ![Python 3.9](https://www.python.org/downloads/release/python-3916/) ![Platform](Platform) ![License](License)"
1.1472,pybroker,3242,Python,trading_core,Algorithmic Trading in Python with Machine Learning,https://github.com/edtechre/pybroker,2026-03-24,"ai, algorithmic-trading, algotrading, artificial-intelligence, backtesting, crypto, cryptocurrency, data-science, finance, framework, investment, machine-learning, python, quantitative-finance, stocks, trading, trading-strategies",NOASSERTION,417,6,"<img src=""https://github.com/edtechre/pybroker/blob/master/docs/_static/pybroker-logo.png?raw=true"" alt=""PyBroker""> ![python](https://www.python.org/) ![Apache 2.0 with Commons Clause](https://www.pybroker.com/en/latest/license.html) ![Documentation Status](https://www.pybroker.com/en/latest/?badge="
1.1393,howtrader,892,Python,trading_core,"Howtrader: A crypto quant framework for developing, backtesting, and executing your own trading strategies. Seamlessly integrates with TradingView and other third-party signals. Simply send a post request to automate trading and order placement. Supports Binance and Okex exchanges.",https://github.com/51bitquant/howtrader,2026-03-24,"51bitquant, algo, binance, binance-api, binance-bot, binance-trader, bitcoin, cryptocurrency, eth, okx-exchange, okx-v5, python, quant, quantitative, trader, trading, tradingview, tradingview-alert, tradingview-webhooks, vnpy",MIT,338,23,"HowTrader 中文文档 What does Howtrader means? It means how to be a trader, especially a quant trader. HowTrader crypto quantitative trading framework, and was forked from VNPY, so the core codes、functions and useages are pretty similar to VNPY, but would be more easy to install and use. By the way, Howt"
1.1392,polymarket-market-maker-bot,319,Python,trading_core,"A production-ready market-making bot for Polymarket’s CLOB. It manages inventory, places optimal quotes, handles cancel/replace cycles, and applies automated risk controls. Designed for efficient spread capture, balanced YES/NO exposure, and real-time orderbook trading with low latency and gas-optimized operations.",https://github.com/lorine93s/polymarket-market-maker-bot,2026-03-24,"algorithmic-trading, automated-trading, clob-market-maker-bot, high-frequency-trading, inventory-management, liquidity-provider, liquidity-providers, market-maker-bot, polymarket, polymarket-bot, polymarket-market-maker-bot, polymarket-trading-bot, predictio-market-bot, prediction-markets, promethues-metrics, trading-bot, websocket",,183,4,"Polymarket Market Maker Bot Production-grade **Polymarket CLOB market-making bot** with optimized inventory management, spread farming, intelligent cancel/replace cycles, and automated risk controls. Designed for professional market makers seeking balanced exposure, efficient quote placement, and ma"
1.1301,blankly,2417,Python,trading_core,"🚀 💸  Easily build, backtest and deploy your algo in just a few lines of code. Trade stocks, cryptos, and forex across exchanges w/ one package.",https://github.com/blankly-finance/blankly,2026-03-22,"algotrading, binance, blankly, bot, bot-framework, bots, coinbase, crypto, cryptocurrency, framework, investment, platform, python, stocks, trading, trading-bot, trading-strategies",LGPL-3.0,310,32,"<br /> <div align=""center""> <img style=""margin: 0 auto; padding-bottom: 15px; padding-top: 30px"" width=70%"" src=""https://firebasestorage.googleapis.com/v0/b/blankly-6ada5.appspot.com/o/blankly-github-logo.png?alt=media&token=8f436cd2-3d28-432c-867a-afef780f4260""> </div> <br /> <div align=""center""> <"
1.1299,bitquant,1128,Python,trading_core,51bitquant Python数字货币量化交易视频 CCXT框架 爬取交易所数据 比特币量化交易 交易机器人51bitquant tradingbot cryptocurrency quantitative trading btc trading,https://github.com/51bitquant/bitquant,2026-03-17,"51bitquant, algorithmic-trading, ccxt, cryptocurrency, gekko, high-frequency-trading, klines, marketmaker, python, quant, quantitative-finance, trading, trading-bot, trading-strategies, tradingview, vnpy",MIT,318,2,python数字货币量化交易视频代码 youtube视频链接: https://www.youtube.com/channel/UCjCMoRi4dZ6LRV2KL_RP8KQ/videos B站找到视频链接: https://space.bilibili.com/401686908 币安合约交易快速下单软件下载 链接地址：https://share.weiyun.com/F03qTiin 网易云课堂进阶课程 如果你想学习进阶的课程，可以看下一网易云课堂的视频: https://study.163.com/course/courseMain.htm?courseId=1209509824 课程
1.1253,barter-rs,2031,Rust,trading_core,Open-source Rust framework for building event-driven live-trading & backtesting systems,https://github.com/barter-rs/barter-rs,2026-03-24,"algo-trading, algorithmic-trading, algotrading, backtesting, backtesting-engine, backtesting-frameworks, backtesting-trading-strategies, crypto-bot, event-driven, hft, high-frequency-trading, market-making, quant, quantitative-finance, rust, trading-bot, trading-platform, trading-simulator, trading-strategies, trading-systems",MIT,325,72,"Barter Barter is an algorithmic trading ecosystem of Rust libraries for building high-performance live-trading, paper-trading and back-testing systems. * **Fast**: Written in native Rust. Minimal allocations. Data-oriented state management system with direct index lookups. * **Robust**: Strongly typ"
1.1223,QuantDinger,1045,Python,trading_core,"AI-driven, local-first quantitative trading platform for research, backtesting and live execution. Python-native, privacy-first, open source.",https://github.com/brokermr810/QuantDinger,2026-03-24,"ai-trading, algo-trading, algorithmic-trading, backtesting, llm, local-first, multi-agent, polymarket, quantitative-trading, systematic-trading, trading-platform, vibe-coding, vibe-trading",Apache-2.0,263,6,
1.1193,adamant-tradebot,776,JavaScript,trading_core,"Free self-hosted market-making bot for crypto projects & token issuers. Volume, spread, liquidity, price ranges, and dynamic order books — all in one.",https://github.com/Adamant-im/adamant-tradebot,2026-03-24,"algorithmic-trading, bitcoin, blockchain, crypto, crypto-bot, crypto-exchanges, cryptocurrency, liquidity, market-liquidity, market-making, order-book, orderbook, self-hosted, spread, trading, trading-bot, trading-volume, volume",,236,9,
1.1185,Options-Trading-Strategies-in-Python,975,Python,trading_core,Developing Options Trading Strategies using Technical Indicators and Quantitative Methods,https://github.com/PyPatel/Options-Trading-Strategies-in-Python,2026-03-24,"indicators, machine-learning, machine-learning-algorithms, options-trading, options-trading-strategies, python, python3, quantitative, quantitative-finance, quantitative-investment, quantitative-strategies, quantitative-trading, technical-indicators",,243,6,
1.1138,Quantitative-Notebooks,1318,Jupyter Notebook,trading_core,"Educational notebooks on quantitative finance, algorithmic trading, financial modelling and investment strategy",https://github.com/LongOnly/Quantitative-Notebooks,2026-03-23,"algorithmic-trading, algotrading, asset-allocation, asset-management, asset-pricing, data-analysis, data-science, financial-analysis, jupyter, machine-learning, notebook, pairs-trading, python, quantitative-finance, quantitative-trading, stock-trading, trading-algorithms, trading-strategies",Apache-2.0,215,0,
1.1117,algotrading,1517,Python,trading_core,Algorithmic trading framework for cryptocurrencies.,https://github.com/ivopetiz/algotrading,2026-03-24,"algorithmic-trading, algotrading, backtest, backtesting-trading-strategies, bot, crypto, crypto-algotrading, cryptocurrencies, cryptocurrency, cryptocurrency-exchanges, framework, hft, hft-trading, high-frequency-trading, realtime, trading, trading-algorithms, trading-api, trading-bot, trading-simulator",MIT,195,8,
1.104,ccxt,41499,Python,trading_infra,A cryptocurrency trading API with more than 100 exchanges in JavaScript / TypeScript / Python / C# / PHP / Go ,https://github.com/ccxt/ccxt,2026-03-24,"altcoin, api, arbitrage, bitcoin, bot, btc, crypto, cryptocurrencies, cryptocurrency, eth, ethereum, exchange, invest, library, market-data, memecoin, merchant, strategy, trade, trading",MIT,8560,1368,
1.1003,Quantdom,761,Python,trading_core,Python-based framework for backtesting trading strategies & analyzing financial markets [GUI :neckbeard:],https://github.com/constverum/Quantdom,2026-03-14,"algorithmic-trading, algotrading, backtesting, finance, financial-analysis, fintech, investment, quant, quantitative-finance, stock-market, trading, trading-platform, trading-strategies",Apache-2.0,190,11,
1.0994,algobot,952,Python,trading_core,"Cryptocurrency trading bot with a graphical user interface with support for simulations, backtests, optimizations, and running live bots.",https://github.com/ZENALC/algobot,2026-03-24,"backtests, bot, crypto, cryptocurrency, optimizations, pyqt, pyqt5, python, robot, simulations, telegram, trade, trading",GPL-3.0,178,23,
1.0905,kalshi-ai-trading-bot,286,Python,trading_core,"🤖 Advanced AI-powered trading system for Kalshi prediction markets. Features Grok-4 integration, multi-agent decision making, portfolio optimization, and real-time market analysis. Educational/research purposes only.",https://github.com/ryanfrigo/kalshi-ai-trading-bot,2026-03-24,"ai-trading, automated-trading, kalshi, machine-learning, portfolio-optimization, prediction-markets, python, quantitative-trading, risk-management, trading-bot",MIT,107,2,
1.09,ampyfin,428,Python,trading_core,"End-to-end ensemble trading framework that trains, backtests, and promotes validated strategies to live execution.",https://github.com/AmpyFin/ampyfin,2026-03-21,"algo-trading, algorithmic-trading, ensemble-learning, finance, machine-learning, open-source, python, trade, trading-algorithms, trading-bot, trading-strategies",MIT,138,14,
1.0885,qf-lib,904,Python,trading_core,"Modular Python library that provides an advanced event driven backtester and a set of high quality tools for quantitative finance. Integrated with various data vendors and brokers, supports Crypto, Stocks and Futures.",https://github.com/quarkfin/qf-lib,2026-03-24,"backtesting, backtesting-frameworks, backtesting-trading-strategies, finance, investment-analysis, python, quant, quantitative-finance, trading, trading-simulator, trading-strategies",Apache-2.0,130,17,
1.0871,rl_trading,288,Python,trading_core,An environment to high-frequency trading agents under reinforcement learning,https://github.com/ucaiado/rl_trading,2026-02-23,"ai, interest-rates, machine-learning, python, q-learning, reinforcement-learning, rl, simulation, tile-coding, trading",Apache-2.0,120,0,
1.0848,indicator,828,Go,trading_core,"Indicator Go delivers a rich set of technical analysis indicators, customizable strategies, and a powerful backtesting framework. No dependencies, just pure simplicity. ✨ See how! 👀",https://github.com/cinar/indicator,2026-03-21,"algorithmic-trading, bollinger-bands, finance, financial-instruments, indicator, indicators, macd, quant, quantative-finance, quantative-trading, quantitative-finance, stock-analysis, stock-market, technical-analysis, technical-analysis-indicators, technical-analysis-library, trading, trading-algorithms, trading-strategies, yahoo-finance",AGPL-3.0,150,40,
1.0794,mmb,599,Rust,trading_core,"Trading bot implemented in Rust, with market making and strategy automation for any exchange or blockchain.",https://github.com/purefinance/mmb,2026-03-23,"bot, crypto, cryptocurrency, marketmaker, marketmaking, orderbook, rust, rust-lang, serum, trading-bot, trading-strategies",GPL-3.0,103,1,
1.0769,huobi_futures_Python,269,Python,trading_core,"An Asynchronous Event-driven High-frequency Trading System,huobi future,huobi coin margined swap, huobi usdt margined swap included.",https://github.com/hbdmapi/huobi_futures_Python,2026-02-24,"hbdm, huobi, huobi-api, huobi-future, huobi-future-api, huobi-future-websocket, huobi-swap, huobi-swap-api, huobi-swap-python, huobi-swap-websocket",MIT,112,9,
1.0737,investing-algorithm-framework,707,Python,trading_core,"Framework for developing, backtesting, and deploying automated trading algorithms and trading bots.",https://github.com/coding-kitties/investing-algorithm-framework,2026-03-24,"algorithmic-trading, backtesting, backtesting-trading-strategies, cryptocurrency, python, quantitative, quantitative-analysis, quantitative-finance, quantitative-trading, trade, trading, trading-bot, trading-bots, trading-strategies",Apache-2.0,93,16,
1.0712,alpha-rptr,638,Python,trading_core,"A trading bot for automated algorithmic trading on Binance Futures, Bybit, BitMEX and FTX written in python.",https://github.com/TheFourGreatErrors/alpha-rptr,2026-03-21,"algo, algorithmic-trading, binance, binance-futures, bitcoin, bitmex, bot, bybit, crypto, cryptocurrency, ftx, ftx-exchange, python, quantitative-trading, trading, trading-bot, trading-systems, websocket",MIT,81,1,
1.0704,bulbea,2266,Python,trading_ml,:boar: :bear: Deep Learning based Python Library for Stock Market Prediction and Modelling,https://github.com/achillesrasquinha/bulbea,2026-03-24,"deep-learning, finance, machine-learning, prediction, python-library, quantitative-finance, quantitative-trading, sentiment-analysis, stock-market, stock-market-prediction, stock-prediction",NOASSERTION,485,36,
1.0666,nautilus_trader,21405,Rust,trading_infra,Production-grade Rust-native trading engine with deterministic event-driven architecture,https://github.com/nautechsystems/nautilus_trader,2026-03-24,"algorithmic-trading-engine, artificial-intelligence, crypto-trading, equity-trading, forex, futures-trading, machine-learning, options-trading, python, rust, sports-betting, trading, trading-platform",LGPL-3.0,2535,63,
1.0656,ai-trader,528,Python,trading_core,"Backtrader-powered backtesting framework for algorithmic trading, featuring 20+ strategies, multi-market support, CLI tools, and an integrated MCP server for professional traders.",https://github.com/whchien/ai-trader,2026-03-23,"ai, ai-agents, algorithmic-trading, backtrader, cli, mcp, mcp-server, portfolio-management, quantitative-finance, stock-price-prediction, trading",GPL-3.0,74,3,
